{
  "episode_id": "ep_01",
  "title": "试炼反杀，暗流初现",
  "core_theme": "绝境反击与阴谋觉醒",
  "hook": "林凡在宗门试炼中遭围攻濒死，却以隐藏实力反杀强敌，更意外揭穿高层设局的真相。",
  "main_conflict": "林凡被赵虎一伙联手围攻，意图废其修为；背后更有执事纵容，实为高层清除计划的一环。",
  "key_events": [
    "林凡在宗门试炼中突遭赵虎等人围攻，濒临重伤之际爆发隐藏实力，强势反杀逼退对手，震惊全场。",
    "林凡敏锐察觉周执事刻意偏袒赵虎、纵容违规，由此推断宗门高层正密谋除掉自己。",
    "从被动求生转向主动调查，林凡决心引幕后黑手现身，开启对抗宗门暗势力的新阶段。"
  ],
  "climax": "林凡以残躯逆转战局，当众击退赵虎，不仅保全自身，更撕开宗门表面秩序下的阴谋一角。",
  "ending_hook": "就在众人以为风波平息时，林凡望向高台上的周执事，眼中寒光闪烁——真正的猎杀，才刚刚开始。",
  "episode_summary": "宗门试炼本应公平，林凡却突遭赵虎等人围攻，意图废其根基。生死一线间，他被迫暴露部分隐藏实力，在重伤边缘强势反杀，逼退赵虎，震慑全场。此战虽胜，却揭开更深黑幕：林凡敏锐察觉周执事全程纵容违规，分明是高层授意铲除自己。从被动挨打到识破阴谋，林凡果断转变策略，决定主动引蛇出洞。本集以一场酣畅淋漓的反杀完成地位反转，又以高层阴谋埋下更大危机，为下一阶段的宗门权斗拉开序幕。"
}