{
  "episode_id": "ep_01",
  "title": "试炼反杀，暗流初现",
  "core_theme": "绝境反击与阴谋觉醒",
  "hook": "林凡在宗门试炼中遭围攻濒死，却以隐藏实力反杀强敌，更意外揭穿高层设局除他的阴谋。",
  "main_conflict": "林凡被赵虎等人围攻意图废掉，背后更有执事纵容，陷入生死与信任双重危机。",
  "key_events": [
    "林凡在宗门试炼中突遭赵虎一伙围攻，身陷绝境",
    "重伤边缘爆发隐藏实力，强势反杀逼退赵虎，震惊全场",
    "察觉周执事刻意偏袒，识破高层欲借试炼除掉自己的阴谋"
  ],
  "climax": "林凡以残躯逆转战局，不仅击退赵虎，更当众揭露试炼中的不公，引发围观弟子哗然。",
  "ending_hook": "面对幕后黑手的阴影，林凡不再被动求生，而是立誓追查真相——但宗门深处，更大的杀局已在酝酿。",
  "episode_summary": "宗门试炼本应是弟子展示天赋的舞台，却成了林凡的生死陷阱。赵虎等人早有预谋，在周执事默许下联手围攻，意图当场废掉他。濒临崩溃之际，林凡被迫暴露部分隐藏实力，以惊人反杀逼退强敌，虽重伤却未败，一举震慑全场。然而，真正的危机才刚刚浮现——他敏锐察觉周执事的偏袒并非偶然，而是高层设局除他的开端。从被动挨打到主动觉醒，林凡决定不再隐忍，誓要揪出幕后黑手。可就在他转身离去时，宗门高塔之上，一双阴冷的眼睛正注视着他，新的杀局已然启动。"
}